step_id,phase,timing,teacher_action,student_action,material_used,activity_type,purpose,expected_output,notes
1,,3分,前時の学習内容を整理し本時のめあてを確認する,前時の学習を振り返り本時の課題を把握する,ワークシート・教科書,導入活動,学習の見通しをもつ,本時の課題理解,大問を確認
2,,5分,冒険マップや現在場面を用いて内容を整理する,8歳の冒険と現在の良平について振り返る,冒険マップ・教科書,内容整理活動,作品全体の構造を再確認する,冒険の全体像の把握,過去と現在の整理
3,,30分,解説書の書き方を説明し必要に応じて支援する,情景描写を根拠に自分なりの解釈をまとめ解説書を書く,ワークシート・教科書・解説書見本,記述活動,作品を多面的に解釈する,私の『トロッコ』解説書,大問への回答を作成
4,,10分,班での交流を促す,解説書を回し読みし感想を書き合う,解説書,交流活動,多様な解釈に触れる,感想記入と意見交流,相互評価
5,,2分,次時の学習内容を伝える,次時の単元テストに向けた見通しをもつ,なし,まとめ活動,学習を締めくくる,次時への準備,単元テスト予告