step_id,phase,timing,teacher_action,student_action,material_used,activity_type,purpose,expected_output,notes
1,導入,5分,既習事項を振り返らせ三角形の合同条件と仮定・結論を確認する,過去の学習内容を確認し証明学習への見通しをもつ,図形資料・板書,振り返り,既習事項を活性化する,合同条件と仮定・結論の確認,前提の確認
2,出合う・結びつける,5分,証明課題を提示し仮定と結論を明確にさせる,問題の仮定と結論を整理する,ワークシート,課題把握,証明の出発点を明確にする,仮定と結論の整理,STEP1
3,向き合う①,10分,合同を示すために必要な条件を考えさせ図への書き込みを促す,図形の性質や条件を書き出して材料を集める,ワークシート,個人思考,証明に必要な根拠を収集する,根拠となる図形の性質一覧,STEP2 材料集め
4,つなげる①,5分,ペア交流を行わせ合同条件の候補を共有させる,互いの考えを比較して合同条件の根拠を整理する,ワークシート,ペア交流,多様な考えを共有する,合同条件の整理,STEP2共有
5,向き合う②,10分,根拠から事実へつながる流れを整理するよう促す,集めた条件を用いて証明の流れを構成する,ワークシート,個人思考,証明の構造を理解する,仮定から結論への論理展開,STEP3 考えの整理
6,つなげる②,5分,証明の流れを交流し改善点を話し合わせる,ペアで証明を読み合い修正点を検討する,ワークシート,相互評価,論理の妥当性を点検する,修正された証明,STEP4 見直し
7,つなげる③,5分,全体共有を通して証明の構造を整理し4つのポイントをまとめる,他者の考えと比較し証明の構造を整理する,板書,全体共有,証明の一般的な手順を理解する,証明の4ステップの整理,前提確認・材料集め・考えの整理・見直し
8,振り返る,5分,適用問題を提示し本時の学習を活用させる,学んだ手順を用いて適用問題に取り組み次時への見通しをもつ,適用問題ワークシート,適用・振り返り,学習内容を定着させる,適用問題の解決,次時への接続