step_id,phase,timing,teacher_action,student_action,material_used,activity_type,purpose,expected_output,notes
1,導入,5分,前時で学習した3Rについて質問しながら復習する,3Rに関する内容をペアでやり取りしながら振り返る,ワークシート,復習活動,既習内容を想起する,3Rに関する英語表現,前時の振り返り
2,展開①,5分,Teacher Talkを行い水の使い方に関する話題を提示する,教師の話を聞き自分の生活における水の使い方を考える,教師提示資料,Teacher Talk,本時のテーマを理解する,水利用に関する気付き,Using waterへの導入
3,展開②,7分,水の無駄遣いについて質問し考えを引き出す,自分や家族の水の使い方について英語で答える,なし,全体交流,水利用の実態を共有する,水利用に関する意見,全体共有
4,展開③,9分,Using waterをテーマにペアワークを指示する,日常生活でどのように水を使っているかをペアで伝え合う,ワークシート,ペア活動,やり取りの基礎を作る,水利用に関する対話,1回目のペア交流
5,展開④,5分,中間評価を行い表現やアイデアを共有する,伝えられなかった表現や良かった表現を共有する,板書・ワークシート,中間評価,表現の幅を広げる,新たな英語表現やアイデア,クラス全体で共有
6,展開⑤,9分,水の節約や無駄遣いについてやり取りするよう促す,水を節約するために自分や家族ができることをペアで伝え合う,ワークシート,ペア活動,改善策について考える,節水に関する意見交換,2回目のペア交流
7,展開⑥,5分,再度中間評価を行い工夫やアイデアを共有する,相手に伝わりやすい表現や節水アイデアを共有する,板書,中間評価,対話内容を深化させる,改善された表現,全体共有
8,まとめ・振り返り,5分,学習内容を整理し振り返りシート記入を指示する,自身の考えや工夫した点を記録する,ワークシート・振り返りシート,振り返り活動,学びを定着させる,振り返り記述,次時への接続