step_id,phase,timing,teacher_action,student_action,material_used,activity_type,purpose,expected_output,notes
1,,5分,黄金比が用いられている図や画像を提示して課題を把握させる,図形の共通点や黄金長方形の特徴について考える,提示画像・タブレット端末,課題把握活動,問題への興味関心を高める,黄金長方形の特徴の理解,課題提示
2,,10分,黄金長方形の性質を基に課題解決の見通しをもたせる,長方形の辺の比に着目し解決方法を考える,提示資料・ワークシート,見通し形成活動,数量関係に着目する,解決方針の整理,既習事項活用
3,,10分,方程式活用のポイントを示し個人思考を支援する,文字を置き二次方程式を立てて黄金比を求める,ワークシート,個人思考活動,二次方程式を活用して問題解決する,黄金比の導出,記録に残す評価対象
4,,10分,交流の視点を示し考えの改善を促す,グループで説明を交流し不足部分を補足する,ワークシート,協働学習,説明をより良くする,修正された説明,赤字で追記
5,,10分,異なる考え方を全体共有し説明のポイントを整理する,他者の説明と比較し共通点や相違点を考える,ワークシート,全体交流,論理的な説明方法を理解する,説明の改善点の把握,全体共有
6,,5分,実測活動を通して結果を検証し学習を振り返らせる,トランプ等の縦横を測定し黄金比との一致を確認する,トランプ・定規,検証活動,数学と実生活のつながりを理解する,黄金比の妥当性の確認,二次方程式の有用性を実感