step_id,phase,timing,teacher_action,student_action,material_used,activity_type,purpose,expected_output,notes
1,導入①,2分,前時のワークシートの答え合わせを行い既習事項を確認する,前時の学習内容を振り返る,ワークシート,復習活動,既習事項を想起する,前時内容の確認,既習事項の整理
2,導入②,3分,国民主権が実現されている場面を問いかける,住民投票や選挙などの事例を挙げる,教科書,発問活動,本時の課題意識をもつ,国民主権の具体例,国民主権の定義確認
3,展開①,5分,本時のめあてを提示する,学習課題を把握する,教科書,課題把握,学習の見通しをもつ,本時の課題理解,めあて確認
4,展開②,15分,憲法改正の手続きや裁判員裁判の資料を配付し考察を促す,資料を読み国民主権がどのように実現されているか個人で考える,資料・タブレット端末・ワークシート,個人思考,国民主権の具体的な実現方法を考察する,個人の考察内容,資料分析
5,展開③,10分,同じ資料を担当した生徒同士で共有させる,ペアで考えを交流し整理する,資料・ワークシート,ペア交流,考えを深める,共有した考察内容,ペア協議
6,展開④,10分,異なる資料を担当したペア同士の交流と全体共有を行う,班や学級全体で考察内容を共有する,資料・ワークシート,協働学習,多面的に国民主権を捉える,国民主権の実現場面に関する発表,全体共有
7,まとめ①,3分,教科書内容を補足説明する,説明を聞き理解を深める,教科書,講義,学習内容を整理する,知識の整理,補足説明
8,まとめ②,2分,振り返りを記入させる,学習の気付きやさらに調べたいことを書く,ふりかえりプリント,振り返り活動,学びを定着させる,振り返り記述,自己評価